{
  "job_id": "c7a8e801-b27b-40b5-9d36-fa28dbfa9801",
  "submission_id": 101,
  "status": "SUCCESS",
  "error_message": null,
  "evaluated_at": "2026-10-28T15:05:00Z",
  "execution_time_seconds": 3.82,
  "model_name": "mock-evaluator-v1",
  "overall_score": 8.05,
  "criteria_results": [
    {
      "criteria_id": 1,
      "score": 8.5,
      "feedback": "Cấu trúc Spring Boot phân tầng rõ ràng (controller, service, repository, entity). DTO được tách biệt tốt với JPA Entity."
    },
    {
      "criteria_id": 2,
      "score": 7.0,
      "feedback": "Cần lưu ý chuyển các secret như database password và JWT key sang biến môi trường (environment variables) hoặc file .env thay vì đặt giá trị fallback mặc định trong repo."
    },
    {
      "criteria_id": 3,
      "score": 8.0,
      "feedback": "Có viết service test với Mockito khá đầy đủ cho luồng chấm điểm (AdminScoreDistributionServiceTest)."
    },
    {
      "criteria_id": 4,
      "score": 9.5,
      "feedback": "Quy chuẩn commit message theo Conventional Commits, có ghi chú chi tiết và tài liệu Markdown hướng dẫn kiểm thử rõ ràng."
    }
  ],
  "evidence": [
    {
      "criteria_id": 1,
      "type": "POSITIVE",
      "file_path": "back-end/src/seal-api/src/main/java/com/seal/hackathon/entity/Score.java",
      "line_start": 10,
      "line_end": 12,
      "snippet": "@Table(name = \"Score\", uniqueConstraints = {\n    @UniqueConstraint(name = \"uq_score\", columnNames = {\"submission_id\", \"judge_user_id\", \"criteria_id\"})\n})",
      "comment": "Cộng điểm: Đã thiết lập ràng buộc duy nhất (Unique Constraint) tại tầng Entity đảm bảo tính toàn vẹn dữ liệu cho việc chấm điểm."
    },
    {
      "criteria_id": 2,
      "type": "PENALTY",
      "file_path": "back-end/src/seal-api/src/main/resources/application.properties",
      "line_start": 13,
      "line_end": 14,
      "snippet": "spring.datasource.username=${DB_USERNAME:root}\nspring.datasource.password=${DB_PASSWORD:***REDACTED***}",
      "comment": "Trừ 3.0 điểm: Mật khẩu database mặc định được khai báo fallback trực tiếp trong file cấu hình (đã che secret), có nguy cơ lộ lọt khi push mã nguồn."
    },
    {
      "criteria_id": 3,
      "type": "POSITIVE",
      "file_path": "back-end/src/seal-api/src/test/java/com/seal/hackathon/service/AdminScoreDistributionServiceTest.java",
      "line_start": 21,
      "line_end": 28,
      "snippet": "@ExtendWith(MockitoExtension.class)\nclass AdminScoreDistributionServiceTest {\n\n    @Mock private HackathonEventRepository eventRepository;\n    @Mock private RoundRepository roundRepository;\n    @Mock private TrackRepository trackRepository;\n    @Mock private ScoringCriteriaRepository criteriaRepository;\n    @Mock private ScoreRepository scoreRepository;",
      "comment": "Cộng điểm: Sử dụng Mockito (@ExtendWith, @Mock) để viết unit test độc lập cho business logic tính toán phân phối điểm."
    },
    {
      "criteria_id": 4,
      "type": "POSITIVE",
      "file_path": "back-end/src/seal-api/Test/ScoringServiceTest.md",
      "line_start": 1,
      "line_end": 5,
      "snippet": "# ScoringService Validation & Test Report\n\nFile service: `src/main/java/com/seal/hackathon/service/ScoringService.java`\n\nFile test: `src/test/java/com/seal/hackathon/service/ScoringServiceTest.java`",
      "comment": "Cộng điểm: Tài liệu hóa rõ ràng các kịch bản kiểm thử và quy ước nghiệp vụ đi kèm từng service trong mã nguồn."
    }
  ],
  "summary": "Repository thể hiện kỹ năng tổ chức backend Spring Boot rất tốt, tuân thủ đúng kiến trúc chuẩn và có unit test kèm theo. Điểm cần tối ưu hóa quan trọng nhất là bảo mật secret trong môi trường triển khai."
}
